{
  "work_id": "backend-migration",
  "source_design": "specs/backend-migration/design.json",
  "stages": [
    {
      "id": "STAGE-01",
      "sequence": 1,
      "title": "Characterize the existing Go API and React contract",
      "depends_on": [],
      "targets": [
        "server/handlers.go and server/main.go as the unchanged system under test",
        "server/*_test.go characterization coverage",
        "tests/contract/ reusable black-box HTTP fixtures and assertions",
        "client/src API call sites, payloads, Auth0 flow, and same-origin/local configuration",
        "legacy route/configuration inventory and sanitized caller-evidence record"
      ],
      "acceptance_criteria": ["AC-6"],
      "tests": [
        "Run the current Go test suite before adding tests and retain its result as baseline evidence.",
        "Exercise GET/POST /api/feelings and GET/POST /api/weekly-tracker against the Go service for successful, empty, invalid, missing-token, expired-token, mismatched-user, and cross-user cases using synthetic users and non-private fixtures.",
        "Capture status, headers, JSON shape, field representation, ordering, upsert behavior, and write side effects in reusable black-box assertions; label approved normalization differences separately from behavior that must remain compatible.",
        "Exercise allowed/disallowed CORS preflight and retired or unmatched routes, including /api/ping, without asserting accidental quirks as target requirements.",
        "Trace every React request and Auth0 token/header dependency to the characterized contract and record sanitized evidence that the former OpenClaw/chat/agent routes have no repository caller or active production caller."
      ],
      "definition_of_done": [
        "The existing Go implementation has not been behaviorally changed.",
        "A deterministic characterization suite can run against a configurable base URL and distinguishes preserved behavior from approved normalization.",
        "The four supported routes and all React request shapes are covered, including two-user isolation scenarios.",
        "Route retirement evidence is recorded without tokens, subjects, notes, or other private values; contrary evidence stops retirement and returns the work to Define.",
        "Baseline test commands and results are ready to be recorded as implementation evidence."
      ]
    },
    {
      "id": "STAGE-02",
      "sequence": 2,
      "title": "Establish the pinned standalone Deno foundation",
      "depends_on": ["STAGE-01"],
      "targets": [
        "api/ standalone Deno TypeScript service skeleton",
        "deno.json and deno.lock",
        "OCI container definition and reproducible build inputs",
        "Deno dependency and permission compatibility record"
      ],
      "acceptance_criteria": [],
      "tests": [
        "Pin a stable Deno 2 container/runtime version, run deno check and the selected test runner, and verify lockfile integrity in a clean build.",
        "Spike the selected HTTP, strict-schema, Auth0/JWKS, PostgreSQL, logging, and test dependencies under Deno without implementing business routes.",
        "Build and start the OCI image with only documented filesystem, network, and environment permissions; verify an unprivileged health endpoint and graceful shutdown.",
        "Verify production dependencies do not require unsafe lifecycle scripts, unsupported native addons, or materially broader permissions than the approved design."
      ],
      "definition_of_done": [
        "Concrete Deno-compatible libraries and build commands are documented and locked.",
        "The service starts reproducibly in an OCI container and emits sanitized structured startup/health logs.",
        "No feelings, weekly, Data API, Edge Function, Storage, job, or operator behavior has been introduced.",
        "Any failed compatibility spike returns the runtime or dependency choice to Design rather than adding a hidden workaround."
      ]
    },
    {
      "id": "STAGE-03",
      "sequence": 3,
      "title": "Provision an authorized non-production Supabase target",
      "depends_on": ["STAGE-02"],
      "targets": [
        "Supabase non-production project in Sydney ap-southeast-2",
        "supabase/ local configuration and versioned migration workspace",
        "managed secret references for migration-owner and runtime database connections",
        "non-production backup, restore, audit, and Data API exposure settings record"
      ],
      "acceptance_criteria": [],
      "tests": [
        "Before creating cloud infrastructure, record the separate explicit human authorization required by AGENTS.md; plan approval alone is insufficient.",
        "Verify the project reports Sydney ap-southeast-2 and record the chosen plan's backup behavior; for Free, document the approved manual backup/restore process and require an Australian encrypted destination before loading representative data.",
        "Verify the preferred direct TLS migration path when the test network supports the project's IPv6 endpoint; otherwise verify the approved TLS Supavisor session fallback from the IPv4-only environment. Verify the candidate pooled/runtime connection mode without printing credentials.",
        "Verify the application schema is absent from the Data API exposed-schema list and that no browser or service-role secret is introduced.",
        "Run the current Supabase CLI help/version discovery and scan the current Supabase changelog for relevant breaking changes before locking provisioning commands."
      ],
      "definition_of_done": [
        "A separately authorized, empty, non-production Sydney project is available and identified only by non-secret configuration references.",
        "Managed backup availability or absence, the approved manual fallback where needed, restore access, provider audit controls, and operator access are documented without secret values.",
        "Migration and runtime connection choices are verified against the selected container network; the TLS session fallback is used where direct IPv6 is unavailable, and prepared statements are disabled for transaction-pooled runtime traffic.",
        "No production infrastructure, data, environment, endpoint, or traffic has changed."
      ]
    },
    {
      "id": "STAGE-04",
      "sequence": 4,
      "title": "Create the private Postgres schema, roles, constraints, and RLS",
      "depends_on": ["STAGE-03"],
      "targets": [
        "supabase/migrations/ private feelings and weekly-tracker schema history",
        "least-privilege migration-owner and runtime roles/grants",
        "forced RLS policies using transaction-local app.auth0_sub",
        "database constraint, index, and policy tests"
      ],
      "acceptance_criteria": [],
      "tests": [
        "Apply all migrations to an empty local/test database, inspect migration history, roll back where defined, and reapply from zero.",
        "Assert feelings types, defaults, status constraint, legacy ID uniqueness, and composite (user_id, created_at desc, id desc) index.",
        "Assert weekly mood/version constraints, UNIQUE(user_id, week_of), timestamp behavior, and atomic INSERT ON CONFLICT update behavior.",
        "With two synthetic Auth0 subjects, test SELECT/INSERT and weekly UPDATE USING/WITH CHECK policies, missing transaction identity, ownership reassignment, DELETE denial, and absence of BYPASSRLS/table ownership for the runtime role.",
        "Verify the private schema is not Data API exposed, anon/authenticated/service-role grants are not used by the application, RLS is forced, and Supabase database/security advisors report no unresolved finding relevant to the schema."
      ],
      "definition_of_done": [
        "The schema matches DATA-001 through DATA-005 and can be reproduced solely from version-controlled migrations.",
        "Database tests prove durable constraints and two-subject row isolation independently of application filters.",
        "The runtime role has only required table operations and no DELETE, owner, BYPASSRLS, or service-role capability.",
        "No production database migration has been applied."
      ]
    },
    {
      "id": "STAGE-05",
      "sequence": 5,
      "title": "Build and validate the idempotent data migration path",
      "depends_on": ["STAGE-04"],
      "targets": [
        "tools/migrate/ standalone Deno TypeScript Mongo-to-Postgres migration CLI",
        "synthetic and representative non-production MongoDB export fixtures",
        "sanitized reconciliation and exception-manifest formats",
        "target-to-Mongo rollback reconciliation tool and fixtures"
      ],
      "acceptance_criteria": ["AC-10"],
      "tests": [
        "Dry-run valid, malformed, duplicate, orphaned, mixed-type, and repeat-input fixtures without writing private content to output.",
        "Import representative non-production feelings and weekly trackers, preserving Auth0 sub and approved timestamps while mapping source _id to legacy_mongo_id.",
        "Run the import twice and assert stable counts, stable non-content hashes, no duplicate target rows, and explicit reporting of every rejected or conflicting source record.",
        "Run forward reconciliation by collection and user and exercise target-to-Mongo reconciliation on synthetic target-only writes.",
        "Require Vinicius Delascio's explicit recorded decision for each real cleanup, transformation, quarantine, or exclusion before treating reconciliation as successful."
      ],
      "definition_of_done": [
        "Every representative source record is deterministically migrated or appears in a sanitized exception manifest.",
        "Repeatability and rollback reconciliation tests pass without duplicate or lost records.",